{
  "adapter": "yolo",
  "capability": "person_detection",
  "evaluation_evidence": [
    "https://artifacts.example/evaluation.json#sha256=cccccccccccccccccccccccccccccccccccccccccccccccccccccccccccccccc"
  ],
  "license_id": "LicenseRef-Proprietary-Approved",
  "model_card": "https://artifacts.example/model-card.json#sha256=bbbbbbbbbbbbbbbbbbbbbbbbbbbbbbbbbbbbbbbbbbbbbbbbbbbbbbbbbbbbbbbb",
  "model_id": "scenara.portrait.person-detector",
  "production_ready": true,
  "regression_samples": [
    "portrait-regression-v1"
  ],
  "runtime_model_id": "scenara.portrait/person_detector_v1",
  "schema_version": "1.0",
  "sha256": "aaaaaaaaaaaaaaaaaaaaaaaaaaaaaaaaaaaaaaaaaaaaaaaaaaaaaaaaaaaaaaaa",
  "source_uri": "oci://registry.example/scenara/person-detector@sha256:aaaaaaaaaaaaaaaaaaaaaaaaaaaaaaaaaaaaaaaaaaaaaaaaaaaaaaaaaaaaaaaa",
  "version": "1.0.0",
  "vram_mb": 4096
}
